{
 "constraints": [
  {
   "id": "C1",
   "key": "infill_sparse_density",
   "op": "max",
   "reason": "synthetic",
   "severity": "error",
   "value": 25
  },
  {
   "id": "C2",
   "key": "wall_line_count",
   "op": "min",
   "reason": "synthetic",
   "severity": "error",
   "value": 5
  }
 ],
 "contract": "stage3.feedback",
 "exclude": [],
 "iteration": 1,
 "result": "needs_changes",
 "version": "0.1",
 "warnings": []
}
